{
  "$schema": "./schema.json",
  "status": "released",
  "variant": "benchlab-original",
  "identity": {
    "vendor_id": 238,
    "product_id": 16,
    "fw_version": 5
  },
  "usb": {
    "vid": 1155,
    "pid": 22336,
    "note": "stock ST descriptors; cannot identify a BENCHLAB -- use WELCOME + READ_VENDOR_DATA"
  },
  "constants": {
    "CAL_FACTORY": 1,
    "CAL_MUL": 4096,
    "CAL_NUM": 2,
    "CAL_SHIFT_BITS": 12,
    "CAL_USER": 0,
    "CONFIG_STR_LEN": 32,
    "CONFIG_VERSION": 0,
    "FAN_CURVE_NUM_POINTS": 2,
    "FAN_NUM": 9,
    "FAN_PROFILE_NUM": 3,
    "FIRMWARE_VERSION": 5,
    "PRODUCT_ID": 16,
    "RGB_PROFILE_NUM": 2,
    "SENSOR_POWER_NUM": 11,
    "SENSOR_VIN_NUM": 13,
    "TS_1": 0,
    "TS_2": 1,
    "TS_3": 2,
    "TS_4": 3,
    "TS_NUM": 4,
    "UPDATE_FLAG_CLEAR": 0,
    "UPDATE_FLAG_LOAD_DEFAULTS": 2,
    "UPDATE_FLAG_STORE": 1,
    "VENDOR_ID": 238
  },
  "enum_width_bytes": {
    "FAN_SWITCH_STATUS": 1,
    "RGB_SWITCH_STATUS": 1,
    "RGB_EXT_STATUS": 1,
    "FAN_MODE": 1,
    "TEMP_SRC": 1,
    "FAN_STOP": 1,
    "RGB_MODE": 1,
    "RGB_DIRECTION": 1,
    "TS_B": 1,
    "BUTTON": 1
  },
  "enums": {
    "FAN_SWITCH_STATUS": {
      "FAN_SWITCH_STATUS_AUTO": 0,
      "FAN_SWITCH_STATUS_50_PERCENT": 1,
      "FAN_SWITCH_STATUS_100_PERCENT": 2
    },
    "RGB_SWITCH_STATUS": {
      "RGB_SWITCH_STATUS_WORK": 0,
      "RGB_SWITCH_STATUS_PLAY": 1
    },
    "RGB_EXT_STATUS": {
      "RGB_EXT_STATUS_NOT_DETECTED": 0,
      "RGB_EXT_STATUS_DETECTED": 1
    },
    "FAN_MODE": {
      "FAN_MODE_TEMP_CONTROL": 0,
      "FAN_MODE_FIXED": 1,
      "FAN_MODE_EXT": 2
    },
    "TEMP_SRC": {
      "TEMP_SRC_AUTO": 0,
      "TEMP_SRC_TS1": 1,
      "TEMP_SRC_TS2": 2,
      "TEMP_SRC_TS3": 3,
      "TEMP_SRC_TS4": 4,
      "TEMP_SRC_TAMB": 5
    },
    "FAN_STOP": {
      "FAN_STOP_OFF": 0,
      "FAN_STOP_ON": 1
    },
    "RGB_MODE": {
      "RGB_MODE_RAINBOW_CYCLE": 0,
      "RGB_MODE_RAINBOW_COLOR_CHASE": 1,
      "RGB_MODE_RAINBOW": 2,
      "RGB_MODE_TWINKLE": 3,
      "RGB_MODE_METEOR_SHOWER": 4,
      "RGB_MODE_COLOR_WIPE": 5,
      "RGB_MODE_THEATRE_CHASE": 6,
      "RGB_MODE_FADE_IN_OUT": 7,
      "RGB_MODE_SINGLE_COLOR_CHASE": 8,
      "RGB_MODE_SINGLE_COLOR": 9
    },
    "RGB_DIRECTION": {
      "RGB_DIRECTION_CLOCKWISE": 0,
      "RGB_DIRECTION_COUNTER_CLOCKWISE": 1
    },
    "TS_B": {
      "TS_B_3950": 0,
      "TS_B_3380": 1
    },
    "BUTTON": {
      "BUTTON_POWER": 0,
      "BUTTON_RESET": 1,
      "BUTTON_OTHER": 2
    }
  },
  "structs": {
    "VendorDataStruct": {
      "size": 3,
      "fields": [
        {
          "name": "VendorId",
          "type": "uint8_t",
          "array": null,
          "offset": 0,
          "size": 1
        },
        {
          "name": "ProductId",
          "type": "uint8_t",
          "array": null,
          "offset": 1,
          "size": 1
        },
        {
          "name": "FwVersion",
          "type": "uint8_t",
          "array": null,
          "offset": 2,
          "size": 1
        }
      ]
    },
    "PowerSensor": {
      "size": 12,
      "fields": [
        {
          "name": "Voltage",
          "type": "int16_t",
          "array": null,
          "offset": 0,
          "size": 2
        },
        {
          "name": "Current",
          "type": "int32_t",
          "array": null,
          "offset": 4,
          "size": 4
        },
        {
          "name": "Power",
          "type": "int32_t",
          "array": null,
          "offset": 8,
          "size": 4
        }
      ]
    },
    "FanSensor": {
      "size": 4,
      "fields": [
        {
          "name": "Enable",
          "type": "uint8_t",
          "array": null,
          "offset": 0,
          "size": 1
        },
        {
          "name": "Duty",
          "type": "uint8_t",
          "array": null,
          "offset": 1,
          "size": 1
        },
        {
          "name": "Tach",
          "type": "uint16_t",
          "array": null,
          "offset": 2,
          "size": 2
        }
      ]
    },
    "SensorStruct": {
      "size": 216,
      "fields": [
        {
          "name": "Vin",
          "type": "int16_t",
          "array": "13",
          "offset": 0,
          "size": 26
        },
        {
          "name": "Vdd",
          "type": "uint16_t",
          "array": null,
          "offset": 26,
          "size": 2
        },
        {
          "name": "Vref",
          "type": "uint16_t",
          "array": null,
          "offset": 28,
          "size": 2
        },
        {
          "name": "Tchip",
          "type": "int16_t",
          "array": null,
          "offset": 30,
          "size": 2
        },
        {
          "name": "Ts",
          "type": "int16_t",
          "array": "4",
          "offset": 32,
          "size": 8
        },
        {
          "name": "Tamb",
          "type": "int16_t",
          "array": null,
          "offset": 40,
          "size": 2
        },
        {
          "name": "Hum",
          "type": "uint16_t",
          "array": null,
          "offset": 42,
          "size": 2
        },
        {
          "name": "FanSwitchStatus",
          "type": "FAN_SWITCH_STATUS",
          "array": null,
          "offset": 44,
          "size": 1
        },
        {
          "name": "RGBSwitchStatus",
          "type": "RGB_SWITCH_STATUS",
          "array": null,
          "offset": 45,
          "size": 1
        },
        {
          "name": "RgbExtStatus",
          "type": "RGB_EXT_STATUS",
          "array": null,
          "offset": 46,
          "size": 1
        },
        {
          "name": "FanExtDuty",
          "type": "uint8_t",
          "array": null,
          "offset": 47,
          "size": 1
        },
        {
          "name": "PowerReadings",
          "type": "PowerSensor",
          "array": "11",
          "offset": 48,
          "size": 132
        },
        {
          "name": "Fans",
          "type": "FanSensor",
          "array": "9",
          "offset": 180,
          "size": 36
        }
      ]
    },
    "FanConfigStruct": {
      "size": 14,
      "fields": [
        {
          "name": "FanMode",
          "type": "FAN_MODE",
          "array": null,
          "offset": 0,
          "size": 1
        },
        {
          "name": "TempSource",
          "type": "TEMP_SRC",
          "array": null,
          "offset": 1,
          "size": 1
        },
        {
          "name": "Temp",
          "type": "int16_t",
          "array": "2",
          "offset": 2,
          "size": 4
        },
        {
          "name": "Duty",
          "type": "uint8_t",
          "array": "2",
          "offset": 6,
          "size": 2
        },
        {
          "name": "RampStep",
          "type": "uint8_t",
          "array": null,
          "offset": 8,
          "size": 1
        },
        {
          "name": "FixedDuty",
          "type": "uint8_t",
          "array": null,
          "offset": 9,
          "size": 1
        },
        {
          "name": "MinDuty",
          "type": "uint8_t",
          "array": null,
          "offset": 10,
          "size": 1
        },
        {
          "name": "MaxDuty",
          "type": "uint8_t",
          "array": null,
          "offset": 11,
          "size": 1
        },
        {
          "name": "FanStop",
          "type": "FAN_STOP",
          "array": null,
          "offset": 12,
          "size": 1
        }
      ]
    },
    "RGBConfigStruct": {
      "size": 6,
      "fields": [
        {
          "name": "Mode",
          "type": "RGB_MODE",
          "array": null,
          "offset": 0,
          "size": 1
        },
        {
          "name": "Red",
          "type": "uint8_t",
          "array": null,
          "offset": 1,
          "size": 1
        },
        {
          "name": "Green",
          "type": "uint8_t",
          "array": null,
          "offset": 2,
          "size": 1
        },
        {
          "name": "Blue",
          "type": "uint8_t",
          "array": null,
          "offset": 3,
          "size": 1
        },
        {
          "name": "Direction",
          "type": "RGB_DIRECTION",
          "array": null,
          "offset": 4,
          "size": 1
        },
        {
          "name": "Speed",
          "type": "uint8_t",
          "array": null,
          "offset": 5,
          "size": 1
        }
      ]
    },
    "CalibrationValueStruct": {
      "size": 4,
      "fields": [
        {
          "name": "Offset",
          "type": "int16_t",
          "array": null,
          "offset": 0,
          "size": 2
        },
        {
          "name": "GainOffset",
          "type": "int16_t",
          "array": null,
          "offset": 2,
          "size": 2
        }
      ]
    },
    "CalibrationStruct": {
      "size": 178,
      "fields": [
        {
          "name": "Crc",
          "type": "uint16_t",
          "array": null,
          "offset": 0,
          "size": 2
        },
        {
          "name": "Vin",
          "type": "CalibrationValueStruct",
          "array": "13",
          "offset": 2,
          "size": 52
        },
        {
          "name": "Vdd",
          "type": "CalibrationValueStruct",
          "array": null,
          "offset": 54,
          "size": 4
        },
        {
          "name": "Vref",
          "type": "CalibrationValueStruct",
          "array": null,
          "offset": 58,
          "size": 4
        },
        {
          "name": "Ts",
          "type": "CalibrationValueStruct",
          "array": "4",
          "offset": 62,
          "size": 16
        },
        {
          "name": "TsB",
          "type": "TS_B",
          "array": "4",
          "offset": 78,
          "size": 4
        },
        {
          "name": "Tamb",
          "type": "CalibrationValueStruct",
          "array": null,
          "offset": 82,
          "size": 4
        },
        {